[
  {
    "id": "AGT-0001",
    "ficticio": true,
    "origem": "demo",
    "criadoEm": "2026-10-01T12:00:00.000Z",
    "atualizadoEm": "2026-10-01T12:00:00.000Z",
    "criadoPor": "humano",
    "nome": "CEO — agente de IA (demo)",
    "papel": "ceo",
    "tipo": "agente_ia",
    "superiorId": "AGT-0007",
    "email": null,
    "ativo": true
  },
  {
    "id": "AGT-0002",
    "ficticio": true,
    "origem": "demo",
    "criadoEm": "2026-10-01T12:00:00.000Z",
    "atualizadoEm": "2026-10-01T12:00:00.000Z",
    "criadoPor": "humano",
    "nome": "Diretor Comercial — agente de IA (demo)",
    "papel": "diretor",
    "tipo": "agente_ia",
    "superiorId": "AGT-0001",
    "email": null,
    "ativo": true
  },
  {
    "id": "AGT-0003",
    "ficticio": true,
    "origem": "demo",
    "criadoEm": "2026-10-01T12:00:00.000Z",
    "atualizadoEm": "2026-10-01T12:00:00.000Z",
    "criadoPor": "humano",
    "nome": "Gerente Comercial — agente de IA (demo)",
    "papel": "gerente",
    "tipo": "agente_ia",
    "superiorId": "AGT-0002",
    "email": null,
    "ativo": true
  },
  {
    "id": "AGT-0004",
    "ficticio": true,
    "origem": "demo",
    "criadoEm": "2026-10-01T12:00:00.000Z",
    "atualizadoEm": "2026-10-01T12:00:00.000Z",
    "criadoPor": "humano",
    "nome": "Vendedor — agente de IA (demo)",
    "papel": "vendedor",
    "tipo": "agente_ia",
    "superiorId": "AGT-0003",
    "email": null,
    "ativo": true
  },
  {
    "id": "AGT-0005",
    "ficticio": true,
    "origem": "demo",
    "criadoEm": "2026-10-01T12:00:00.000Z",
    "atualizadoEm": "2026-10-01T12:00:00.000Z",
    "criadoPor": "humano",
    "nome": "Vendedora Ana (FICTÍCIA)",
    "papel": "vendedor",
    "tipo": "humano",
    "superiorId": "AGT-0003",
    "email": null,
    "ativo": true
  },
  {
    "id": "AGT-0006",
    "ficticio": true,
    "origem": "demo",
    "criadoEm": "2026-10-01T12:00:00.000Z",
    "atualizadoEm": "2026-10-01T12:00:00.000Z",
    "criadoPor": "humano",
    "nome": "Vendedor Bruno (FICTÍCIO)",
    "papel": "vendedor",
    "tipo": "humano",
    "superiorId": "AGT-0003",
    "email": null,
    "ativo": true
  },
  {
    "id": "AGT-0007",
    "ficticio": true,
    "origem": "demo",
    "criadoEm": "2026-10-01T12:00:00.000Z",
    "atualizadoEm": "2026-10-01T12:00:00.000Z",
    "criadoPor": "humano",
    "nome": "Responsável humano (demo)",
    "papel": "humano",
    "tipo": "humano",
    "superiorId": null,
    "email": null,
    "ativo": true
  }
]
